id,created_at,full_text,media,screen_name,name,profile_image_url,in_reply_to,retweeted_status,quoted_status,favorite_count,retweet_count,bookmark_count,quote_count,reply_count,views_count,favorited,retweeted,bookmarked,url
"1866264064181371008","2024-12-10 07:30:01 +08:00","A 1916 speech on the importance of the fur trade to American development:\n\n""The history of North American expansion might almost be written in terms of the fur trade....Many a nameless trader, intent only upon his trade and caring nothing for the name of discoverer, has been the first white man to set foot upon lands credit for the discovery of which has gone to others... Even to-day the Hudson Bay Company’s posts in northern Canada are the outposts of civilization on that last remnant of the American fur-trading frontier. Thus the fur trader has blazed the way across the continent.""\n\nhttps://t.co/lK0Fev2EiD","[{""type"":""photo"",""url"":""https://t.co/Rt5QR2288F"",""thumbnail"":""https://pbs.twimg.com/media/GeZM6qyXIAAXsT8?format=jpg&name=thumb"",""original"":""https://pbs.twimg.com/media/GeZM6qyXIAAXsT8?format=jpg&name=orig""}]","lhamtil","Lawrence Hamtil","https://pbs.twimg.com/profile_images/1700605419419279360/yD5Iv4eG_normal.jpg","null","null","null",6,1,0,0,0,1974,false,false,false,"https://twitter.com/lhamtil/status/1866264064181371008"
"1866484154780836120","2024-12-10 22:04:34 +08:00","RT @DAG_Investments: Btw, for those interested in the water business in general, there's a free water technology e-book available on the In…","[]","lhamtil","Lawrence Hamtil","https://pbs.twimg.com/profile_images/1700605419419279360/yD5Iv4eG_normal.jpg","null","1866470251891704310","null",0,1,0,0,0,"null",false,false,false,"https://twitter.com/lhamtil/status/1866484154780836120"
"1866541402924122343","2024-12-11 01:52:03 +08:00","Limestone, like broader aggregates, has proven resilient in terms of pricing power https://t.co/inG8NSVQI6","[{""type"":""photo"",""url"":""https://t.co/inG8NSVQI6"",""thumbnail"":""https://pbs.twimg.com/media/GedJYxmXsAAwcvS?format=jpg&name=thumb"",""original"":""https://pbs.twimg.com/media/GedJYxmXsAAwcvS?format=jpg&name=orig""}]","lhamtil","Lawrence Hamtil","https://pbs.twimg.com/profile_images/1700605419419279360/yD5Iv4eG_normal.jpg","null","null","1855302154761666922",9,1,2,0,2,2348,false,false,false,"https://twitter.com/lhamtil/status/1866541402924122343"
"1866604560774762635","2024-12-11 06:03:01 +08:00","This was an excellent episode.  I really enjoyed listening to Ash Park alum Jamie Isenwater discuss the role of distribution in forming a moat around large spirits companies, and why so many upstart brands are in a hurry to sell out.\n\nh/t @fmcbill \n\nhttps://t.co/GP16rclHgM","[]","lhamtil","Lawrence Hamtil","https://pbs.twimg.com/profile_images/1700605419419279360/yD5Iv4eG_normal.jpg","null","null","null",28,1,11,0,3,3256,false,false,false,"https://twitter.com/lhamtil/status/1866604560774762635"
"1866639095616901563","2024-12-11 08:20:15 +08:00","We'd all be killing each other if we allowed back pain to justify our worst impulses 🙄","[]","lhamtil","Lawrence Hamtil","https://pbs.twimg.com/profile_images/1700605419419279360/yD5Iv4eG_normal.jpg","null","null","1866244824921465121",43,0,0,0,8,6571,false,false,false,"https://twitter.com/lhamtil/status/1866639095616901563"
"1866952272057454827","2024-12-12 05:04:42 +08:00","Everyone who doesn't own AI plays this year https://t.co/evjrC7TG3j","[{""type"":""animated_gif"",""url"":""https://t.co/evjrC7TG3j"",""thumbnail"":""https://pbs.twimg.com/tweet_video_thumb/Gei_MeVXYAA7Aed.jpg?name=thumb"",""original"":""https://video.twimg.com/tweet_video/Gei_MeVXYAA7Aed.mp4"",""ext_alt_text"":""Wallet GIF""}]","lhamtil","Lawrence Hamtil","https://pbs.twimg.com/profile_images/1700605419419279360/yD5Iv4eG_normal.jpg","null","null","null",40,0,2,0,2,2459,false,false,false,"https://twitter.com/lhamtil/status/1866952272057454827"
"1866991323347095955","2024-12-12 07:39:53 +08:00","RT @LockheedMartin: @EricLDaugh This is false reporting and fake news.","[]","lhamtil","Lawrence Hamtil","https://pbs.twimg.com/profile_images/1700605419419279360/yD5Iv4eG_normal.jpg","null","1866975108772008335","null",0,78,0,0,0,4,false,false,false,"https://twitter.com/lhamtil/status/1866991323347095955"
"1866996908524441763","2024-12-12 08:02:04 +08:00","RT @DannyOcean555: Here’s a bull case for govt contractors CACI/SAIC/BAH if “efficiency” cuts actually hit the discretionary budget:\n\nBlank…","[{""type"":""photo"",""url"":""https://t.co/41XhmR4FPX"",""thumbnail"":""https://pbs.twimg.com/media/Gefr0JoWcAAermT?format=jpg&name=thumb"",""original"":""https://pbs.twimg.com/media/Gefr0JoWcAAermT?format=jpg&name=orig""}]","lhamtil","Lawrence Hamtil","https://pbs.twimg.com/profile_images/1700605419419279360/yD5Iv4eG_normal.jpg","null","1866719855275360526","null",0,1,0,0,0,"null",false,false,false,"https://twitter.com/lhamtil/status/1866996908524441763"
"1867032589187551232","2024-12-12 10:23:51 +08:00","When reading the history of the early North American colonies, I usually forget what was going on back in Europe. Interesting to note that New England, New Netherland, and New Sweden were being established and expanded while the Thirty Years' War, proportionally the deadliest in Europe's history, was raging.","[]","lhamtil","Lawrence Hamtil","https://pbs.twimg.com/profile_images/1700605419419279360/yD5Iv4eG_normal.jpg","null","null","null",14,1,1,0,2,3534,false,false,false,"https://twitter.com/lhamtil/status/1867032589187551232"
"1867187449304121806","2024-12-12 20:39:13 +08:00","The difference between the French and English North American colonial approaches https://t.co/54ejjPT32y","[{""type"":""photo"",""url"":""https://t.co/54ejjPT32y"",""thumbnail"":""https://pbs.twimg.com/media/GemVDAmXwAAXS8T?format=jpg&name=thumb"",""original"":""https://pbs.twimg.com/media/GemVDAmXwAAXS8T?format=jpg&name=orig""}]","lhamtil","Lawrence Hamtil","https://pbs.twimg.com/profile_images/1700605419419279360/yD5Iv4eG_normal.jpg","1864001989916360749","null","null",12,0,0,0,2,3845,false,false,false,"https://twitter.com/lhamtil/status/1867187449304121806"
"1867222450657694153","2024-12-12 22:58:18 +08:00","The female mind cannot comprehend that a dude can find one pair of pants that fits perfectly and can be quite content wearing them until they are worn down to just a zipper and belt loops.","[]","lhamtil","Lawrence Hamtil","https://pbs.twimg.com/profile_images/1700605419419279360/yD5Iv4eG_normal.jpg","null","null","null",181,3,4,0,17,13266,false,false,false,"https://twitter.com/lhamtil/status/1867222450657694153"
"1867231399196905847","2024-12-12 23:33:51 +08:00","The reasons guys wear the same thing all the time are that 1) we have limited brain power, so we can't afford to waste it on making one more decision, and 2) we can't remember names, so our de facto uniforms become our identifiers","[]","lhamtil","Lawrence Hamtil","https://pbs.twimg.com/profile_images/1700605419419279360/yD5Iv4eG_normal.jpg","1867222450657694153","null","null",32,0,0,1,9,2690,false,false,false,"https://twitter.com/lhamtil/status/1867231399196905847"
"1867369074378125707","2024-12-13 08:40:56 +08:00","I think of this story a lot","[]","lhamtil","Lawrence Hamtil","https://pbs.twimg.com/profile_images/1700605419419279360/yD5Iv4eG_normal.jpg","null","null","1627053553532694528",20,0,1,0,2,3419,false,false,false,"https://twitter.com/lhamtil/status/1867369074378125707"
"1867543678702522880","2024-12-13 20:14:44 +08:00","This should be bullish for reshoring and railroads","[]","lhamtil","Lawrence Hamtil","https://pbs.twimg.com/profile_images/1700605419419279360/yD5Iv4eG_normal.jpg","null","null","1867351590451003501",12,0,1,0,2,3456,false,false,false,"https://twitter.com/lhamtil/status/1867543678702522880"
"1867732273514098979","2024-12-14 08:44:09 +08:00","Now this is white privilege","[]","lhamtil","Lawrence Hamtil","https://pbs.twimg.com/profile_images/1700605419419279360/yD5Iv4eG_normal.jpg","null","null","1867589545501310993",30,0,1,0,4,4793,false,false,false,"https://twitter.com/lhamtil/status/1867732273514098979"
"1867775910780289264","2024-12-14 11:37:33 +08:00","Both America's and Russia's respective drives to the Pacific were fueled by the fur trade:\n\n""At the same time that French and British (and to a lesser extent, Dutch, and Swedish) fur traders were exploring the virgin forests of North America in the late sixteenth and early seventeenth centuries, Russians were moving east toward the Siberian tundra in search of sable, also known as “soft gold,” the most expensive fur in the world.""\n\nhttps://t.co/kKI7qSNbLC","[]","lhamtil","Lawrence Hamtil","https://pbs.twimg.com/profile_images/1700605419419279360/yD5Iv4eG_normal.jpg","null","null","null",4,0,0,0,1,2133,false,false,false,"https://twitter.com/lhamtil/status/1867775910780289264"
"1867979098917949570","2024-12-15 01:04:57 +08:00","My wife &amp; I sold some old clocks on marketplace, &amp; the gentleman who bought them is Vietnamese-American. His dad was an Air Force serviceman in Vietnam in the 60s &amp; fell in love with a Vietnamese woman. This gentleman and his dad were separated for 30 years before reuniting. 🇺🇸","[]","lhamtil","Lawrence Hamtil","https://pbs.twimg.com/profile_images/1700605419419279360/yD5Iv4eG_normal.jpg","null","null","null",14,0,0,0,1,2346,false,false,false,"https://twitter.com/lhamtil/status/1867979098917949570"
"1867987160785358900","2024-12-15 01:36:59 +08:00","All I'm saying is that we should return to great company names like Baltimore Aircoil Company.\n\nhttps://t.co/CTUsTb7qgn","[]","lhamtil","Lawrence Hamtil","https://pbs.twimg.com/profile_images/1700605419419279360/yD5Iv4eG_normal.jpg","null","null","null",5,1,0,0,2,1912,false,false,false,"https://twitter.com/lhamtil/status/1867987160785358900"
"1868064307403002116","2024-12-15 06:43:32 +08:00","😍 https://t.co/x3vHtLEdNS","[{""type"":""photo"",""url"":""https://t.co/x3vHtLEdNS"",""thumbnail"":""https://pbs.twimg.com/media/GeyylRSWQAAgwgk?format=jpg&name=thumb"",""original"":""https://pbs.twimg.com/media/GeyylRSWQAAgwgk?format=jpg&name=orig""}]","lhamtil","Lawrence Hamtil","https://pbs.twimg.com/profile_images/1700605419419279360/yD5Iv4eG_normal.jpg","null","null","null",48,0,0,0,10,3887,false,false,false,"https://twitter.com/lhamtil/status/1868064307403002116"
"1868292160942117211","2024-12-15 21:48:57 +08:00","16/ Winner Sells All\n\nGreat book on the ecommerce war between Amazon and Walmart \n\nhttps://t.co/r5hX6qTV26","[]","lhamtil","Lawrence Hamtil","https://pbs.twimg.com/profile_images/1700605419419279360/yD5Iv4eG_normal.jpg","1868291880779124970","null","null",3,0,1,0,2,801,false,false,false,"https://twitter.com/lhamtil/status/1868292160942117211"
"1868293769260654929","2024-12-15 21:55:20 +08:00","17/ The World for Sale\n\nGreat overview of the commodities trading world \n\nhttps://t.co/wc9OfocSnA","[]","lhamtil","Lawrence Hamtil","https://pbs.twimg.com/profile_images/1700605419419279360/yD5Iv4eG_normal.jpg","1868292160942117211","null","null",10,0,3,0,1,1870,false,false,false,"https://twitter.com/lhamtil/status/1868293769260654929"
"1868294192570733046","2024-12-15 21:57:01 +08:00","18/ Driving Honda\n\nGood book about the economics of car manufacturing \n\nhttps://t.co/DxKqOL6Dto","[]","lhamtil","Lawrence Hamtil","https://pbs.twimg.com/profile_images/1700605419419279360/yD5Iv4eG_normal.jpg","1868293769260654929","null","null",6,0,3,0,0,1634,false,false,false,"https://twitter.com/lhamtil/status/1868294192570733046"
"1868483773081555334","2024-12-16 10:30:20 +08:00","Really looking forward to this from @djrosent and @gilbert\n\nhttps://t.co/mVwWe8lzbA","[]","lhamtil","Lawrence Hamtil","https://pbs.twimg.com/profile_images/1700605419419279360/yD5Iv4eG_normal.jpg","1820532365158195353","null","1868368557240987678",8,0,0,0,0,3425,false,false,false,"https://twitter.com/lhamtil/status/1868483773081555334"
"1868747901633282375","2024-12-17 03:59:54 +08:00","Went down the rabbit hole on cooling towers this past weekend.  Was surprised that ~2/3 of revenue is from replacement orders for $SPXC. https://t.co/TgfkCxsM0d","[{""type"":""photo"",""url"":""https://t.co/TgfkCxsM0d"",""thumbnail"":""https://pbs.twimg.com/media/Ge8gRTdWMAAVMYh?format=jpg&name=thumb"",""original"":""https://pbs.twimg.com/media/Ge8gRTdWMAAVMYh?format=jpg&name=orig""}]","lhamtil","Lawrence Hamtil","https://pbs.twimg.com/profile_images/1700605419419279360/yD5Iv4eG_normal.jpg","null","null","null",10,0,3,0,1,2058,false,false,false,"https://twitter.com/lhamtil/status/1868747901633282375"
"1869026310976331787","2024-12-17 22:26:12 +08:00","Didn't know that Walmart heir John Walton was in MACV-SOG and was awarded a Silver Star.","[]","lhamtil","Lawrence Hamtil","https://pbs.twimg.com/profile_images/1700605419419279360/yD5Iv4eG_normal.jpg","null","null","1869016289127309790",8,0,0,0,1,2900,false,false,false,"https://twitter.com/lhamtil/status/1869026310976331787"
"1869054867614073328","2024-12-18 00:19:40 +08:00","RT @scuttleblurb: Earlier this year my kid brother, Rich, took his own life.  Rich loved this country and devoted his adult life to its def…","[{""type"":""photo"",""url"":""https://t.co/K7DeVU56TY"",""thumbnail"":""https://pbs.twimg.com/media/GfA00tcaEAA5o8W?format=jpg&name=thumb"",""original"":""https://pbs.twimg.com/media/GfA00tcaEAA5o8W?format=jpg&name=orig""}]","lhamtil","Lawrence Hamtil","https://pbs.twimg.com/profile_images/1700605419419279360/yD5Iv4eG_normal.jpg","null","1869052623539900668","null",0,62,0,0,0,"null",false,false,false,"https://twitter.com/lhamtil/status/1869054867614073328"
"1869099525115465892","2024-12-18 03:17:07 +08:00","Really enjoyed this one.  A couple chocolate ""what-ifs"":\n\nIn 1929, Hershey was reportedly in talks to merge with Colgate &amp; Kraft\n\nhttps://t.co/B76U8dGA10\n\nIn 1991, Nestle was said to have to been in talks to merge with Mars\n\nhttps://t.co/LpPexPePeM https://t.co/ZhbdLoK3z5","[{""type"":""photo"",""url"":""https://t.co/ZhbdLoK3z5"",""thumbnail"":""https://pbs.twimg.com/media/GfBgDu1WUAA5CNY?format=jpg&name=thumb"",""original"":""https://pbs.twimg.com/media/GfBgDu1WUAA5CNY?format=jpg&name=orig""},{""type"":""photo"",""url"":""https://t.co/ZhbdLoK3z5"",""thumbnail"":""https://pbs.twimg.com/media/GfBgGlGWsAApTKJ?format=jpg&name=thumb"",""original"":""https://pbs.twimg.com/media/GfBgGlGWsAApTKJ?format=jpg&name=orig""}]","lhamtil","Lawrence Hamtil","https://pbs.twimg.com/profile_images/1700605419419279360/yD5Iv4eG_normal.jpg","null","null","1868679538550681820",9,0,2,1,3,2980,false,false,false,"https://twitter.com/lhamtil/status/1869099525115465892"
"1869479687979974951","2024-12-19 04:27:45 +08:00","RT @lhamtil: ""Show me a portfolio, I’ll tell you the generation. The really old generation, the gray-beards, they’re the ones with General…","[{""type"":""photo"",""url"":""https://t.co/LlJ7Am5knq"",""thumbnail"":""https://pbs.twimg.com/media/FDZGysUXsAMtc5W?format=jpg&name=thumb"",""original"":""https://pbs.twimg.com/media/FDZGysUXsAMtc5W?format=jpg&name=orig""}]","lhamtil","Lawrence Hamtil","https://pbs.twimg.com/profile_images/1700605419419279360/yD5Iv4eG_normal.jpg","null","1456429773627006979","null",0,8,0,0,0,"null",false,false,false,"https://twitter.com/lhamtil/status/1869479687979974951"
"1869484394425262092","2024-12-19 04:46:27 +08:00","Having flashbacks of December 2018","[]","lhamtil","Lawrence Hamtil","https://pbs.twimg.com/profile_images/1700605419419279360/yD5Iv4eG_normal.jpg","null","null","null",124,11,5,1,15,21867,false,false,false,"https://twitter.com/lhamtil/status/1869484394425262092"
"1869489378470543504","2024-12-19 05:06:15 +08:00","Imagine telling your family Christmas is canceled because your Fartcoin calls expired worthless","[]","lhamtil","Lawrence Hamtil","https://pbs.twimg.com/profile_images/1700605419419279360/yD5Iv4eG_normal.jpg","1869484394425262092","null","null",44,3,0,0,4,4616,false,false,false,"https://twitter.com/lhamtil/status/1869489378470543504"
"1869505466721775843","2024-12-19 06:10:11 +08:00","Very humbling to work up to a triple 50lbs less than the same scheme 8 months ago, but setbacks happen, and the rock beckons https://t.co/f27o9kAD51","[{""type"":""animated_gif"",""url"":""https://t.co/f27o9kAD51"",""thumbnail"":""https://pbs.twimg.com/tweet_video_thumb/GfHRTsaWIAASJ0j.jpg?name=thumb"",""original"":""https://video.twimg.com/tweet_video/GfHRTsaWIAASJ0j.mp4""}]","lhamtil","Lawrence Hamtil","https://pbs.twimg.com/profile_images/1700605419419279360/yD5Iv4eG_normal.jpg","null","null","null",23,0,0,0,2,2117,false,false,false,"https://twitter.com/lhamtil/status/1869505466721775843"
"1869529095404687685","2024-12-19 07:44:05 +08:00","Guys posting their PA performance\n\nMarket gods: https://t.co/DNGR4gUb5J","[{""type"":""animated_gif"",""url"":""https://t.co/DNGR4gUb5J"",""thumbnail"":""https://pbs.twimg.com/tweet_video_thumb/GfHmzPjXQAEKTxD.jpg?name=thumb"",""original"":""https://video.twimg.com/tweet_video/GfHmzPjXQAEKTxD.mp4""}]","lhamtil","Lawrence Hamtil","https://pbs.twimg.com/profile_images/1700605419419279360/yD5Iv4eG_normal.jpg","1869489378470543504","null","null",21,1,0,0,2,2224,false,false,false,"https://twitter.com/lhamtil/status/1869529095404687685"
"1869542303393849612","2024-12-19 08:36:34 +08:00","This turned out to be my most widely read post of the year.\n\nSome echoes of the interstate highway bill in the more recent infrastructure spending programs.","[]","lhamtil","Lawrence Hamtil","https://pbs.twimg.com/profile_images/1700605419419279360/yD5Iv4eG_normal.jpg","null","null","1765775695798534589",10,0,2,0,0,3535,false,false,false,"https://twitter.com/lhamtil/status/1869542303393849612"
"1869747179033862340","2024-12-19 22:10:40 +08:00","I never put 2 &amp; 2 together that the Waldorf Astoria was named after the Astors' ancestral Black Forest city of Walldorf","[]","lhamtil","Lawrence Hamtil","https://pbs.twimg.com/profile_images/1700605419419279360/yD5Iv4eG_normal.jpg","null","null","null",14,0,1,0,5,2055,false,false,false,"https://twitter.com/lhamtil/status/1869747179033862340"
"1869769017105506757","2024-12-19 23:37:26 +08:00","Good chart from KKR showing that government has picked up the slack as far as borrowing goes vs corporations and households https://t.co/PjoVJ7Weli","[{""type"":""photo"",""url"":""https://t.co/PjoVJ7Weli"",""thumbnail"":""https://pbs.twimg.com/media/GfLBAtFXIAAVZcY?format=jpg&name=thumb"",""original"":""https://pbs.twimg.com/media/GfLBAtFXIAAVZcY?format=jpg&name=orig""}]","lhamtil","Lawrence Hamtil","https://pbs.twimg.com/profile_images/1700605419419279360/yD5Iv4eG_normal.jpg","null","null","null",17,1,0,0,0,3862,false,false,false,"https://twitter.com/lhamtil/status/1869769017105506757"
"1869771149598744877","2024-12-19 23:45:55 +08:00","So funny to me that people were talking about an asset shortage for the market going higher in recent years when during the biggest bubble of all time the supply of available equity was expanding every year https://t.co/r83Dh07XNX","[{""type"":""photo"",""url"":""https://t.co/r83Dh07XNX"",""thumbnail"":""https://pbs.twimg.com/media/GfLC7suXkAAme5M?format=jpg&name=thumb"",""original"":""https://pbs.twimg.com/media/GfLC7suXkAAme5M?format=jpg&name=orig""}]","lhamtil","Lawrence Hamtil","https://pbs.twimg.com/profile_images/1700605419419279360/yD5Iv4eG_normal.jpg","null","null","null",12,0,1,0,3,1970,false,false,false,"https://twitter.com/lhamtil/status/1869771149598744877"
"1869841972955099642","2024-12-20 04:27:20 +08:00","I think this is long-term bullish for renovation spend","[]","lhamtil","Lawrence Hamtil","https://pbs.twimg.com/profile_images/1700605419419279360/yD5Iv4eG_normal.jpg","null","null","1772800865046253682",8,0,3,0,0,2824,false,false,false,"https://twitter.com/lhamtil/status/1869841972955099642"
"1869858683523608675","2024-12-20 05:33:45 +08:00","Here's a good infographic from the Census Bureau on home improvements made 2019 - 2021\n\nhttps://t.co/6NSy7EBZ3I https://t.co/v8ZrAvqiVO","[{""type"":""photo"",""url"":""https://t.co/v8ZrAvqiVO"",""thumbnail"":""https://pbs.twimg.com/media/GfMSe_nW4AAxU3P?format=jpg&name=thumb"",""original"":""https://pbs.twimg.com/media/GfMSe_nW4AAxU3P?format=jpg&name=orig""}]","lhamtil","Lawrence Hamtil","https://pbs.twimg.com/profile_images/1700605419419279360/yD5Iv4eG_normal.jpg","null","null","null",9,1,1,0,1,1907,false,false,false,"https://twitter.com/lhamtil/status/1869858683523608675"
"1870082514703777998","2024-12-20 20:23:10 +08:00","And here we go\nhttps://t.co/hfmpd84IzH","[]","lhamtil","Lawrence Hamtil","https://pbs.twimg.com/profile_images/1700605419419279360/yD5Iv4eG_normal.jpg","1766253780931059913","null","null",10,0,0,0,2,1283,false,false,false,"https://twitter.com/lhamtil/status/1870082514703777998"
"1870153556264951995","2024-12-21 01:05:28 +08:00","RT @AcquiredFM: Mars Inc had 14% revenue growth... for a century. Truly rarefied air. https://t.co/pWSEunGWQr","[{""type"":""photo"",""url"":""https://t.co/pWSEunGWQr"",""thumbnail"":""https://pbs.twimg.com/media/GfQYBi7XEAAPGBC?format=jpg&name=thumb"",""original"":""https://pbs.twimg.com/media/GfQYBi7XEAAPGBC?format=jpg&name=orig""}]","lhamtil","Lawrence Hamtil","https://pbs.twimg.com/profile_images/1700605419419279360/yD5Iv4eG_normal.jpg","null","1870146164353339418","null",0,15,0,0,0,"null",false,false,false,"https://twitter.com/lhamtil/status/1870153556264951995"
"1870245100925915395","2024-12-21 07:09:14 +08:00","This is such a difficult, but necessary read:\n\n""The twisted genius of this disease begins with the way it smuggles itself in under the cover of other conditions. Absent-mindedness, ageing, menopause, through depression, anxiety and epilepsy – all would be presented as perfectly plausible explanations, first by me, then by some serious experts in their field.""\n\nhttps://t.co/bmsCsJWhIf","[]","lhamtil","Lawrence Hamtil","https://pbs.twimg.com/profile_images/1700605419419279360/yD5Iv4eG_normal.jpg","null","null","null",21,0,6,0,5,4379,false,false,false,"https://twitter.com/lhamtil/status/1870245100925915395"
"1870249593092354378","2024-12-21 07:27:05 +08:00","""Its ultimate genius is the way it comes for the very soul of you. You never hear about a brave fight against dementia, as you do so many other conditions, because you can’t fight it. To fight is to make a choice, which requires cognition. By degrees, dementia disables that faculty, rendering its victim helpless.""","[]","lhamtil","Lawrence Hamtil","https://pbs.twimg.com/profile_images/1700605419419279360/yD5Iv4eG_normal.jpg","1870245100925915395","null","null",5,0,1,0,0,1884,false,false,false,"https://twitter.com/lhamtil/status/1870249593092354378"
"1870266221523832881","2024-12-21 08:33:09 +08:00","Water &amp; sewer related inflation has been running at around 4% annually since 1998, outpacing broad inflation by about 150 bps. It's probably good news that water supply-related construction has really picked up of late, with little sign of slowing down. https://t.co/nn1yf8ecIE","[{""type"":""photo"",""url"":""https://t.co/nn1yf8ecIE"",""thumbnail"":""https://pbs.twimg.com/media/GfSFNzaWkAAC4Op?format=png&name=thumb"",""original"":""https://pbs.twimg.com/media/GfSFNzaWkAAC4Op?format=png&name=orig""}]","lhamtil","Lawrence Hamtil","https://pbs.twimg.com/profile_images/1700605419419279360/yD5Iv4eG_normal.jpg","null","null","null",15,0,3,1,4,2906,false,false,false,"https://twitter.com/lhamtil/status/1870266221523832881"
"1870305031700037977","2024-12-21 11:07:22 +08:00","Before railroads and highways made transcontinental commerce easy, there was the rendezvous system, devised by mountain man legend William Henry Ashley, which shortened the journeys trappers would have to make in order to sell their furs.\n\nhttps://t.co/DTufQ7o9HH","[]","lhamtil","Lawrence Hamtil","https://pbs.twimg.com/profile_images/1700605419419279360/yD5Iv4eG_normal.jpg","null","null","null",14,2,3,0,3,2299,false,false,false,"https://twitter.com/lhamtil/status/1870305031700037977"
"1870603071149179386","2024-12-22 06:51:40 +08:00","If you're not sure what to give a  nerd this Christmas, consider gifting a subscription to the @Pfdshares podcast.  He/she doesn't have to know it's free, but nerds everywhere will be jealous of the knowledge you have bestowed upon your loved one.\n\nhttps://t.co/EDjaiGd8C4","[]","lhamtil","Lawrence Hamtil","https://pbs.twimg.com/profile_images/1700605419419279360/yD5Iv4eG_normal.jpg","null","null","null",27,3,3,0,0,4093,false,false,false,"https://twitter.com/lhamtil/status/1870603071149179386"
"1870835054299255138","2024-12-22 22:13:30 +08:00","RT @DevinLaSarre: Newest out.\n\nThe U.S. Nicotine Market: Odds and Ends\n\n$MO $PM $BTI $IMBBY $STG $HAYPP https://t.co/JjsM69x0Pw","[{""type"":""photo"",""url"":""https://t.co/JjsM69x0Pw"",""thumbnail"":""https://pbs.twimg.com/media/GfaAHp7XMAA6gfn?format=jpg&name=thumb"",""original"":""https://pbs.twimg.com/media/GfaAHp7XMAA6gfn?format=jpg&name=orig""}]","lhamtil","Lawrence Hamtil","https://pbs.twimg.com/profile_images/1700605419419279360/yD5Iv4eG_normal.jpg","null","1870823726482100411","null",0,4,0,0,0,"null",false,false,false,"https://twitter.com/lhamtil/status/1870835054299255138"
"1870838940514873854","2024-12-22 22:28:56 +08:00","I enjoyed this from @rhunterh \n\n""Most investors claim they do not want to lose money, but in practice, they either take foolish risks to make it quickly or, with great discipline, lose it slowly.""\n\nhttps://t.co/cm7kfAVCM2","[]","lhamtil","Lawrence Hamtil","https://pbs.twimg.com/profile_images/1700605419419279360/yD5Iv4eG_normal.jpg","null","null","null",28,2,10,0,0,2644,false,false,false,"https://twitter.com/lhamtil/status/1870838940514873854"
