id,created_at,full_text,media,screen_name,name,profile_image_url,in_reply_to,retweeted_status,quoted_status,favorite_count,retweet_count,bookmark_count,quote_count,reply_count,views_count,favorited,retweeted,bookmarked,url
"1846284771036667960","2024-10-16 04:19:26 +08:00","I have had countless things forwarded to me with the headline “this sounds like your stuff” or “didn’t you write this a couple months ago?”\n\nMy response is always the same - “glad people are coming around to my thesis, means the trade should work well”.","[]","Citrini7","Citrini","https://pbs.twimg.com/profile_images/1875761503686582272/VhlaZoEp_normal.jpg","null","null","null",109,2,4,0,4,12503,false,false,false,"https://twitter.com/Citrini7/status/1846284771036667960"
"1846336072818495609","2024-10-16 07:43:17 +08:00","gonna take next week of october off to prepare myself for the inevitable brain damage that trading the U.S. election will inflict upon me","[]","Citrini7","Citrini","https://pbs.twimg.com/profile_images/1875761503686582272/VhlaZoEp_normal.jpg","null","null","null",294,3,3,0,13,20880,false,false,false,"https://twitter.com/Citrini7/status/1846336072818495609"
"1846408132370612618","2024-10-16 12:29:38 +08:00","$DRUG move reminds me of the summer of 22 Hong Kong small cap IPO pump and dump schemes, a brief moment of silliness in the bear market that was extremely fun (both for the long on the way up and short afterwards)","[]","Citrini7","Citrini","https://pbs.twimg.com/profile_images/1875761503686582272/VhlaZoEp_normal.jpg","null","null","1565074204973752320",58,1,6,0,3,18879,false,false,false,"https://twitter.com/Citrini7/status/1846408132370612618"
"1846566567795900563","2024-10-16 22:59:11 +08:00","This is what I get for ever trying to trade natural gas.\n\nOther two worked ok tho. https://t.co/Kd9lRahxRL","[{""type"":""photo"",""url"":""https://t.co/Kd9lRahxRL"",""thumbnail"":""https://pbs.twimg.com/media/GaBSgZ3WoAA97qx?format=jpg&name=thumb"",""original"":""https://pbs.twimg.com/media/GaBSgZ3WoAA97qx?format=jpg&name=orig""}]","Citrini7","Citrini","https://pbs.twimg.com/profile_images/1875761503686582272/VhlaZoEp_normal.jpg","null","null","null",36,0,1,0,10,9468,false,false,false,"https://twitter.com/Citrini7/status/1846566567795900563"
"1846848960733835732","2024-10-17 17:41:19 +08:00","expectations vs reality are such a big deal in markets.\n\nfor example, I expect the bloomberg header image on their leading story to always be some AI generated slop or low effort intern level photoshop. which is why this slam dunk is even better and made my morning. \n\nif this was anywhere else, i’d say “nice” and move on. because it’s on BBA, i fully believe it belongs in the louvre.\n\nthere’s probably some other weird example that i could use if I was a nerd that goes like “semicap derisked the complex because of non-AI exposures just in time for the companies majorly and primarily exposed to AI to report”\n\nbut I’d rather focus on this little guy:","[{""type"":""photo"",""url"":""https://t.co/YKK38j4bKX"",""thumbnail"":""https://pbs.twimg.com/media/GaFTI_OWwAEtF83?format=jpg&name=thumb"",""original"":""https://pbs.twimg.com/media/GaFTI_OWwAEtF83?format=jpg&name=orig""}]","Citrini7","Citrini","https://pbs.twimg.com/profile_images/1875761503686582272/VhlaZoEp_normal.jpg","null","null","null",73,2,7,0,4,11712,false,false,false,"https://twitter.com/Citrini7/status/1846848960733835732"
"1846876985366134991","2024-10-17 19:32:41 +08:00","I am incredibly proud of the job we did with this basket. \n\nThe performance of our L/S election basket (published March 5th) meant express market trump odds bottomed &amp; rebounded strongly on August 2nd. \n\nThat is ten days before Predictit and two full weeks before Polymarket. https://t.co/Si9k0QlwPC","[{""type"":""photo"",""url"":""https://t.co/Si9k0QlwPC"",""thumbnail"":""https://pbs.twimg.com/media/GaFs1FpWsAATAd3?format=jpg&name=thumb"",""original"":""https://pbs.twimg.com/media/GaFs1FpWsAATAd3?format=jpg&name=orig""}]","Citrini7","Citrini","https://pbs.twimg.com/profile_images/1875761503686582272/VhlaZoEp_normal.jpg","null","null","1824606279173579053",230,9,84,14,13,72846,false,false,false,"https://twitter.com/Citrini7/status/1846876985366134991"
"1846877052336529896","2024-10-17 19:32:57 +08:00","And then, of course, the second was the divergence where in the beginning of August our basket bottomed and began gaining significantly while GOP victory odds decreased dramatically for another two weeks. We took this as a signal to advice clients the Trump trade was back on. https://t.co/A1aiDCVD0P","[{""type"":""photo"",""url"":""https://t.co/A1aiDCVD0P"",""thumbnail"":""https://pbs.twimg.com/media/GaFs5CmXsAEGcaV?format=jpg&name=thumb"",""original"":""https://pbs.twimg.com/media/GaFs5CmXsAEGcaV?format=jpg&name=orig""}]","Citrini7","Citrini","https://pbs.twimg.com/profile_images/1875761503686582272/VhlaZoEp_normal.jpg","1846877046841942370","null","null",11,0,1,0,1,1394,false,false,false,"https://twitter.com/Citrini7/status/1846877052336529896"
"1846877054970605631","2024-10-17 19:32:57 +08:00","This is the difference https://t.co/b2gPsoPaf2 provides. \n\nMy goal is to reclaim basket exposure strategies from the sell-side, dominated by low-effort baskets simply used to sell more trades. Rather, our efforts present them as they should be: uniquely structured risk/return.","[]","Citrini7","Citrini","https://pbs.twimg.com/profile_images/1875761503686582272/VhlaZoEp_normal.jpg","1846877052336529896","null","null",21,1,4,0,1,6510,false,false,false,"https://twitter.com/Citrini7/status/1846877054970605631"
"1846877060322537515","2024-10-17 19:32:59 +08:00","PS: I know baskets have been used to defer responsibility before. \n\n“Oh, we were just creating an index to track x y or z, we didn’t actually think it would be a good trade”.\n\nNot us. \n\nThe ONLY thing CitriniResearch writes about or will ever write about is what we believe are good trades. \n\nThe return since publication (03/05/2024) of the GOP vs DEM L/S basket that we recommended investors use, is +36.19%, for +21.74% of outperformance over SP500.","[{""type"":""photo"",""url"":""https://t.co/Qo1C1aDIDc"",""thumbnail"":""https://pbs.twimg.com/media/GaFs5eXWIAA9IsO?format=jpg&name=thumb"",""original"":""https://pbs.twimg.com/media/GaFs5eXWIAA9IsO?format=jpg&name=orig""}]","Citrini7","Citrini","https://pbs.twimg.com/profile_images/1875761503686582272/VhlaZoEp_normal.jpg","1846877054970605631","null","null",30,0,4,0,1,6292,false,false,false,"https://twitter.com/Citrini7/status/1846877060322537515"
"1846923935344198028","2024-10-17 22:39:15 +08:00","Healthcare’s cyclical inflection continues with SRT echoing MRK in calling a bottom for bioprocessing on the horizon. Meanwhile, in medtech, ELV’s poor results on higher utilization suggests a better outlook for devices\n\nhttps://t.co/kLjgSmTQng https://t.co/y4kkskdGRO","[{""type"":""photo"",""url"":""https://t.co/y4kkskdGRO"",""thumbnail"":""https://pbs.twimg.com/media/GaGXh8DXoAAErl4?format=jpg&name=thumb"",""original"":""https://pbs.twimg.com/media/GaGXh8DXoAAErl4?format=jpg&name=orig""}]","Citrini7","Citrini","https://pbs.twimg.com/profile_images/1875761503686582272/VhlaZoEp_normal.jpg","null","null","1821899833051115889",16,0,9,0,1,12994,false,false,false,"https://twitter.com/Citrini7/status/1846923935344198028"
"1846980057878663404","2024-10-18 02:22:15 +08:00","RT @stevehouf: Smart people are generally afraid of creativity out of social embarrassment or the discomfort of lack of guidelines/“correct…","[]","Citrini7","Citrini","https://pbs.twimg.com/profile_images/1875761503686582272/VhlaZoEp_normal.jpg","null","1846975566383403502","null",0,5,0,0,0,1,false,false,false,"https://twitter.com/Citrini7/status/1846980057878663404"
"1847224044896075891","2024-10-18 18:31:46 +08:00","Despite the pullback in broader Chinese equity indices, the Chinese semi names we highlighted as part of our last update, many are at 52W highs.\n\nFor example - Cambricon, which we went long following Xi’s comments on semi independence months ago.\n\nWe call this approach: https://t.co/pXWFO597zJ","[{""type"":""photo"",""url"":""https://t.co/pXWFO597zJ"",""thumbnail"":""https://pbs.twimg.com/media/GaKoeM1XQAAJtWA?format=jpg&name=thumb"",""original"":""https://pbs.twimg.com/media/GaKoeM1XQAAJtWA?format=jpg&name=orig""},{""type"":""photo"",""url"":""https://t.co/pXWFO597zJ"",""thumbnail"":""https://pbs.twimg.com/media/GaKoeM0W0AALigF?format=jpg&name=thumb"",""original"":""https://pbs.twimg.com/media/GaKoeM0W0AALigF?format=jpg&name=orig""}]","Citrini7","Citrini","https://pbs.twimg.com/profile_images/1875761503686582272/VhlaZoEp_normal.jpg","null","null","null",87,2,29,0,3,12003,false,false,false,"https://twitter.com/Citrini7/status/1847224044896075891"
"1847569916599136285","2024-10-19 17:26:08 +08:00","omg they actually did the thing\n\n“generational opportunity”\n\n@conksresearch https://t.co/qwpzeDh73N","[{""type"":""photo"",""url"":""https://t.co/qwpzeDh73N"",""thumbnail"":""https://pbs.twimg.com/media/GaPi9-fWQAARffQ?format=jpg&name=thumb"",""original"":""https://pbs.twimg.com/media/GaPi9-fWQAARffQ?format=jpg&name=orig""}]","Citrini7","Citrini","https://pbs.twimg.com/profile_images/1875761503686582272/VhlaZoEp_normal.jpg","null","null","null",231,7,12,4,7,25765,false,false,false,"https://twitter.com/Citrini7/status/1847569916599136285"
"1847598203799294008","2024-10-19 19:18:33 +08:00","Alpha Teknova $TKNO is now a triple since we highlighted it to subscribers on 7/23 as part of our ongoing coverage of the cyclical inflection occurring in Life Sciences. https://t.co/uyDVnLO5ou","[{""type"":""photo"",""url"":""https://t.co/uyDVnLO5ou"",""thumbnail"":""https://pbs.twimg.com/media/GaP8xGFbwAAg3Mo?format=jpg&name=thumb"",""original"":""https://pbs.twimg.com/media/GaP8xGFbwAAg3Mo?format=jpg&name=orig""}]","Citrini7","Citrini","https://pbs.twimg.com/profile_images/1875761503686582272/VhlaZoEp_normal.jpg","null","null","null",75,4,9,0,2,12379,false,false,false,"https://twitter.com/Citrini7/status/1847598203799294008"
"1847598209788760146","2024-10-19 19:18:34 +08:00","Read more about this theme as we see it here:\n\nhttps://t.co/kLjgSmTQng","[]","Citrini7","Citrini","https://pbs.twimg.com/profile_images/1875761503686582272/VhlaZoEp_normal.jpg","1847598203799294008","null","null",14,0,8,0,1,6633,false,false,false,"https://twitter.com/Citrini7/status/1847598209788760146"
"1847598213752357108","2024-10-19 19:18:35 +08:00","And read our third installment of “CitriniResearch In Conversation” with the CEO of TKNO, Stephen Gunstream, here:\n\nhttps://t.co/4KAdeECN4w","[]","Citrini7","Citrini","https://pbs.twimg.com/profile_images/1875761503686582272/VhlaZoEp_normal.jpg","1847598209788760146","null","null",11,0,2,0,1,6466,false,false,false,"https://twitter.com/Citrini7/status/1847598213752357108"
"1847910691807666405","2024-10-20 16:00:16 +08:00","been such a good year…genuinely tempted to do the normie thing and degross into the election just in case","[]","Citrini7","Citrini","https://pbs.twimg.com/profile_images/1875761503686582272/VhlaZoEp_normal.jpg","null","null","null",242,2,9,0,18,30975,false,false,false,"https://twitter.com/Citrini7/status/1847910691807666405"
"1848303174194733243","2024-10-21 17:59:51 +08:00","I think that ambiguity surrounding the impact of the hurricanes likely extends this dynamic at least until eoy.","[]","Citrini7","Citrini","https://pbs.twimg.com/profile_images/1875761503686582272/VhlaZoEp_normal.jpg","null","null","1813190726596886688",75,2,5,0,6,25981,false,false,false,"https://twitter.com/Citrini7/status/1848303174194733243"
"1848384905803129167","2024-10-21 23:24:37 +08:00","RT @heartbreakout: We are opening TMT Breakout to paid subs again today after being closed most of the year","[]","Citrini7","Citrini","https://pbs.twimg.com/profile_images/1875761503686582272/VhlaZoEp_normal.jpg","null","1848338185182474748","null",0,5,0,0,0,1,false,false,false,"https://twitter.com/Citrini7/status/1848384905803129167"
"1848491745803161973","2024-10-22 06:29:10 +08:00","RT @JackFarley96: ""Trump steepener"" trade by @Citrini7 first discussed on @ForwardGuidance 1 month ago has done well.\n\n2s30s has exited inv…","[{""type"":""photo"",""url"":""https://t.co/S3ebE7BWuZ"",""thumbnail"":""https://pbs.twimg.com/media/GShijqsXUAAePbs?format=jpg&name=thumb"",""original"":""https://pbs.twimg.com/media/GShijqsXUAAePbs?format=jpg&name=orig""}]","Citrini7","Citrini","https://pbs.twimg.com/profile_images/1875761503686582272/VhlaZoEp_normal.jpg","null","1812816632114446544","null",0,6,0,0,0,"null",false,false,false,"https://twitter.com/Citrini7/status/1848491745803161973"
"1849132097459384776","2024-10-24 00:53:41 +08:00","listen @elonmusk this is kind of my thing so maybe we can arrange some sort of licensing agreement or… https://t.co/HEqfY7Zp6V","[{""type"":""photo"",""url"":""https://t.co/HEqfY7Zp6V"",""thumbnail"":""https://pbs.twimg.com/media/Galv1y9XcAAX9Ym?format=jpg&name=thumb"",""original"":""https://pbs.twimg.com/media/Galv1y9XcAAX9Ym?format=jpg&name=orig""}]","Citrini7","Citrini","https://pbs.twimg.com/profile_images/1875761503686582272/VhlaZoEp_normal.jpg","null","null","null",80,0,7,1,8,12206,false,false,false,"https://twitter.com/Citrini7/status/1849132097459384776"
"1849533102592491761","2024-10-25 03:27:08 +08:00","RT @matthewlesh: Why bother allowing people to access immensely effective life-saving weight loss drugs — when you can instead call for  in…","[]","Citrini7","Citrini","https://pbs.twimg.com/profile_images/1875761503686582272/VhlaZoEp_normal.jpg","null","1849352587339829652","null",0,33,0,0,0,1,false,false,false,"https://twitter.com/Citrini7/status/1849533102592491761"
"1849534562247860443","2024-10-25 03:32:56 +08:00","truly a tragedy they got rid of onion futures https://t.co/Fge2rXDkFf","[{""type"":""photo"",""url"":""https://t.co/Fge2rXDkFf"",""thumbnail"":""https://pbs.twimg.com/media/Gard4HnXcAAmga0?format=jpg&name=thumb"",""original"":""https://pbs.twimg.com/media/Gard4HnXcAAmga0?format=jpg&name=orig""}]","Citrini7","Citrini","https://pbs.twimg.com/profile_images/1875761503686582272/VhlaZoEp_normal.jpg","null","null","null",182,6,1,3,8,22970,false,false,false,"https://twitter.com/Citrini7/status/1849534562247860443"
"1849679186861994300","2024-10-25 13:07:38 +08:00","we are so back","[]","Citrini7","Citrini","https://pbs.twimg.com/profile_images/1875761503686582272/VhlaZoEp_normal.jpg","null","null","1849674580878667926",47,1,11,0,4,18559,false,false,false,"https://twitter.com/Citrini7/status/1849679186861994300"
"1849716164110238118","2024-10-25 15:34:34 +08:00","In honor of the (new) biggest single day move in CLS since we published, I have again removed the paywall on our original long thesis for the next week.\n\nI could write an update, but there’s not much more to say other than “thesis is working”. \n\nhttps://t.co/vERAC3rnyH","[]","Citrini7","Citrini","https://pbs.twimg.com/profile_images/1875761503686582272/VhlaZoEp_normal.jpg","null","null","null",80,6,41,1,3,10830,false,false,false,"https://twitter.com/Citrini7/status/1849716164110238118"
"1849920517345824846","2024-10-26 05:06:35 +08:00","I think about this tweet pretty regularly, not as like a dunk / victory lap thing but as a pretty significant reminder that there is for sure stuff I am currently jaded / biased on that will probably end up working. \n\nDifficult to remain objective sometimes.","[]","Citrini7","Citrini","https://pbs.twimg.com/profile_images/1875761503686582272/VhlaZoEp_normal.jpg","null","null","1648539818954039297",244,2,62,5,13,117826,false,false,false,"https://twitter.com/Citrini7/status/1849920517345824846"
"1849923807839998311","2024-10-26 05:19:40 +08:00","maybe it’s t mobile","[]","Citrini7","Citrini","https://pbs.twimg.com/profile_images/1875761503686582272/VhlaZoEp_normal.jpg","1849921178888175706","null","null",33,0,5,0,6,13005,false,false,false,"https://twitter.com/Citrini7/status/1849923807839998311"
"1849927646370553986","2024-10-26 05:34:55 +08:00","it’s either GEV or TMUS","[]","Citrini7","Citrini","https://pbs.twimg.com/profile_images/1875761503686582272/VhlaZoEp_normal.jpg","1849923807839998311","null","null",32,0,17,0,7,11277,false,false,false,"https://twitter.com/Citrini7/status/1849927646370553986"
"1850005309797827034","2024-10-26 10:43:31 +08:00","the rarest thing you can encounter in europe rn is a euro-value PM who doesn’t hate life.","[]","Citrini7","Citrini","https://pbs.twimg.com/profile_images/1875761503686582272/VhlaZoEp_normal.jpg","null","null","null",114,0,2,1,8,16459,false,false,false,"https://twitter.com/Citrini7/status/1850005309797827034"
"1850027731682984091","2024-10-26 12:12:37 +08:00","needlessly long saturday post,\nplease ignore:\n\nlooking at the thread below, a year later, it’s disappointing how many people who disagreed back then blocked me over it. I mean…\n\nif one of you said to me, entirely matter of fact, that something I was bearish on was a screaming buy likely trading at 2-3x 5yr fwd EPS, I might not enjoy the interaction…\n\nbut blocking would never even cross my mind. tbh, if you ended up being right a year later i’d put notifications on for your posts to ensure i get a better understanding of why my thinking was incorrect.\n\nsocial media has given us unprecedented access to alternative opinions. anon finance twitter is the closest thing we have to an entirely merit based forum for idea exchange. i can say without a doubt: using it as such has improved my own process.\n\nwhat they don’t tell you about risk management: it has just as much to do with risk metrics and portfolio construction as it does graceful recognition of being wrong & action orientation in fixing it.\n\nyou cannot quantify stubbornness or egotism (maybe you can, idk, i’m terrible at math), but you can train yourself to recognize when you’re ignoring salient points that don’t conform to your current view.\n\nif you’re serious about long term outperformance, eventually you’ll discover you need to incorporate the views of others into your process. even if it’s to know when to ignore them. \n\nwith those people, you don’t ever care about how they make you feel, just that they make you money.\n\ni follow a fair share of people on here that i don’t, uh…like. if i had the misfortune of meeting them in person i’d find an excuse to be somewhere else asap. \n\nbut they have views that are either nuanced, differentiated, more specialized or flat out better than my own in their respective fields. people that aren’t just contrarian for the sake of being contrarian*\n\ni’ll never block them. they make a fool out of me when I’m wrong? great - better here than in the order book.\n\nif you’re serious about not getting your face ripped off by risks you’re willfully blind to, i’d reccomend doing the same. \n\npeople who disagree with you (respectfully if possible, but - if they’re *really* good - disrespectfully can be worked with) should be overrepresented in your rolodex. \n\nsee how you feel after a discussion with them. if you are on to something good, you’ll leave feeling more conviction. \n\nthe best investments I have ever made all have in common early conversation(s) with someone intelligent on the opposite side that left me thinking “wow, if *they* don’t get it then there’s no way the market does yet. i should size up”. \n\nif at any point during the exchange I feel like they’re making better points than I am, I know the thesis isn’t “the one” and my time is better spent elsewhere.\n\nno matter what, the market will make you face doubts at some point, better to be prepared for it.","[]","Citrini7","Citrini","https://pbs.twimg.com/profile_images/1875761503686582272/VhlaZoEp_normal.jpg","null","null","1849920517345824846",491,24,228,11,30,119750,false,false,false,"https://twitter.com/Citrini7/status/1850027731682984091"
"1850181466568970247","2024-10-26 22:23:30 +08:00","kind of amped for 25 trades for 2025 already","[]","Citrini7","Citrini","https://pbs.twimg.com/profile_images/1875761503686582272/VhlaZoEp_normal.jpg","null","null","null",185,1,5,0,4,16969,false,false,false,"https://twitter.com/Citrini7/status/1850181466568970247"
"1850522353282806244","2024-10-27 20:58:04 +08:00","I have a new addition to my library, a facsimilie of “Confusions de Confusiones”. \n\nThis was the first book ever written about the stock market. Jose de la Vega, a Spanish trader & moral philosopher during the South Sea Bubble in Amsterdam’s exchange published it in 1688.\n\nIt describes options, buying on margin, market manipulation and, most interestingly, market psychology.\n\nDespite being the first book to explain a stock exchange, it was relatively unknown until an essay was published about it in the late 19th century. \n\nWhile a first edition from 1688 sold at auction for $300,000, if you’re lucky you can find facsimile copies from the late 19th/early 20th century - limited runs that likely were owned for the same reason you will - a trader thought it was cool. \n\nThis copy is from the 1920s.  The first translation of the book into English was not until 1957. \n\nIf any of you are doubting that there is nothing new under the sun when it comes to markets, let me show you a few of the passages…\n\n🧵","[{""type"":""photo"",""url"":""https://t.co/VtwaFQbnLV"",""thumbnail"":""https://pbs.twimg.com/media/Ga5gRXUX0AA37ks?format=jpg&name=thumb"",""original"":""https://pbs.twimg.com/media/Ga5gRXUX0AA37ks?format=jpg&name=orig""},{""type"":""photo"",""url"":""https://t.co/VtwaFQbnLV"",""thumbnail"":""https://pbs.twimg.com/media/Ga5gRXbXMAEQu4l?format=jpg&name=thumb"",""original"":""https://pbs.twimg.com/media/Ga5gRXbXMAEQu4l?format=jpg&name=orig""}]","Citrini7","Citrini","https://pbs.twimg.com/profile_images/1875761503686582272/VhlaZoEp_normal.jpg","null","null","null",621,71,411,18,36,123647,false,false,false,"https://twitter.com/Citrini7/status/1850522353282806244"
"1850522400938479805","2024-10-27 20:58:16 +08:00","On trading off of news:\n\n“Stocks boast of possessing something Divine; the more one discusses them, the less one understands, and the more one uses them, the more one errs.\n\nThere is nothing like buying or selling blindly, doing little, arming oneself with patience, and - if the deadline is approaching - paying the difference (which we call Surplus, meaning excess in French), and extending the trades, constantly following the course without allowing oneself to be distracted by any notable news in between. \n\nI confess that one cannot be compelled to trade out of necessity but only by choice\n\n[…]\n\nKnow that Stocks have three stimuli for rising and three for falling: the state of India, Europe’s disposition, and the game of the Stockholders.\n\nTherefore, they do not derive much benefit from the news, for they interpret it to serve other currents.”","[{""type"":""photo"",""url"":""https://t.co/uwVMaywFC4"",""thumbnail"":""https://pbs.twimg.com/media/Ga5gUGPXMAAbGNW?format=jpg&name=thumb"",""original"":""https://pbs.twimg.com/media/Ga5gUGPXMAAbGNW?format=jpg&name=orig""},{""type"":""photo"",""url"":""https://t.co/uwVMaywFC4"",""thumbnail"":""https://pbs.twimg.com/media/Ga5gUGSWAAAygxE?format=jpg&name=thumb"",""original"":""https://pbs.twimg.com/media/Ga5gUGSWAAAygxE?format=jpg&name=orig""}]","Citrini7","Citrini","https://pbs.twimg.com/profile_images/1875761503686582272/VhlaZoEp_normal.jpg","1850522392562376995","null","null",48,3,5,1,1,8773,false,false,false,"https://twitter.com/Citrini7/status/1850522400938479805"
"1850522404537196910","2024-10-27 20:58:16 +08:00","If you enjoyed this, consider checking out this (totally free!) article.\n\nIt opens with what is perhaps my favorite line of this book:\n\n“Please note, this trade became a game out of necessity.”\n\nhttps://t.co/0aiV7ACtdu","[]","Citrini7","Citrini","https://pbs.twimg.com/profile_images/1875761503686582272/VhlaZoEp_normal.jpg","1850522400938479805","null","null",90,8,42,0,11,12773,false,false,false,"https://twitter.com/Citrini7/status/1850522404537196910"
"1850713606762979333","2024-10-28 09:38:03 +08:00","evergreen tweet tbh","[]","Citrini7","Citrini","https://pbs.twimg.com/profile_images/1875761503686582272/VhlaZoEp_normal.jpg","null","null","1839293512099262582",232,8,2,0,19,33414,false,false,false,"https://twitter.com/Citrini7/status/1850713606762979333"
"1850883403173814701","2024-10-28 20:52:45 +08:00","if you’re curious about how the bond market is thinking about the election, it’s very clear - this is why trump would be inflationary. https://t.co/9V7rDcbzQs","[{""type"":""photo"",""url"":""https://t.co/9V7rDcbzQs"",""thumbnail"":""https://pbs.twimg.com/media/Ga-opSAWYAAkVk_?format=jpg&name=thumb"",""original"":""https://pbs.twimg.com/media/Ga-opSAWYAAkVk_?format=jpg&name=orig""}]","Citrini7","Citrini","https://pbs.twimg.com/profile_images/1875761503686582272/VhlaZoEp_normal.jpg","null","null","1850631936072438066",58,4,6,0,9,21814,false,false,false,"https://twitter.com/Citrini7/status/1850883403173814701"
"1850945876719448229","2024-10-29 01:01:00 +08:00","these were worth $375 when they got called in June.","[]","Citrini7","Citrini","https://pbs.twimg.com/profile_images/1875761503686582272/VhlaZoEp_normal.jpg","null","null","1683630842596261888",91,1,13,0,2,21103,false,false,false,"https://twitter.com/Citrini7/status/1850945876719448229"
